name,latitude,longitude,address,description,imagepath,author
Fauerbach House,43.079079,-89.366686,940 Spaight Street,"<p>The Fauerbach House, a Greek Revival side-passage frame dwelling built in 1856, represents a common form and  popular style in Third Lake Ridge during the first few decades of development. Its history shows the path of assimilation of a prominent German family, the Fauerbachs, during the late nineteenth and early twentieth centuries as well as the changing uses of dwellings such as this in the neighborhood. Although its basic form is readable today, the house has undergone many changes that make its interpretation difficult on the basis of the built fabric alone.</p><p>The Fauerbach House was built by Erastus Wyman, a Yankee carpenter from New York. Initially a carpenter, Wyman eventually went into business and opened a lumberyard. Wyman's relative affluence is suggested by the stylish attributes of the house as well as its location within a cluster of homes of wealthy early Madisonians; next door stood the imposing Shipley-Shuttleworth House and across the street was Farwell's Octagon House (now demolished). </p><p>The front-facing gable, intact cornice returns, and symmetrical placement of the windows (with the exception of the replaced picture window on the first floor) are hallmarks of the Greek Revival style. Interior elements, such as the original newel post and door casings in the front passage and elsewhere in the house, also suggest the original owner's affluence. It is also possible that the house had a one-story colonnaded entry porch. Recent renovations revealed that the frame house originally had brick nogging. </p><p>Henry Fauerbach, part owner of the Fauerbach Brewery, purchased the house in 1890. One of the city's oldest and most successful breweries, Fauerbach Brewery was started in 1868 by Henry's father, Peter, an immigrant from Fauerbach, Germany. He initially leased the Sprecher Brewery building and eventually purchased it in 1878. </p><p>Peter and his wife, Maria, had six sons: Louis, Philip, Henry, Charles, Emil, and William. Upon Peter's death in 1886, Maria ran the business for five years until 1891. At that point, the four oldest children assumed company leadership, with Charles eventually going into other occupations outside of the brewery and Emil entering the business when he became old enough.</p><p> Under the leadership of this second generation of Fauerbachs, the brewery would experience levels of growth that Peter could never have imagined. In 1878, after running the business for ten years, the brewery had the capacity to produce 1,500 barrels of beer per year. By 1907 Fauerbach Brewing Co. had twenty cellar tanks, each with the capacity to hold 240 barrels of beer for a total of 4,800 barrels of beer at one time. </p><p>Prohibition and the Great Depression dealt a severe blow to the Fauerbach Brewing Company. The fact the brewery managed other interests, including rental housing, partly kept them afloat for a time. Nevertheless, the Fauerbachs were forced to foreclose on the house in 1927.</p><p> The brewery was the only one in Madison to survive prohibition; however, it fell victim to the growth of large commercial breweries and ultimately closed in 1966. The Fauerbach House remained a multi-unit rental property until 1985 when the current owners purchased it. They have since been working on restoring the property, and have converted it back to a single-family dwelling.</p>",img/TLR/fauerbach.png,"Kimberly Hernandez, Amy Brabender, and Jared Lowery"
Hyers Hotel,43.079,-89.36903,854 Jenifer Street,"<p>Hyer's Hotel was built in 1854, the same year the railroad first reached Madison. The building is the oldest surviving hotel in Madison. Italianate in style, it was originally constructed with soft locally produced red brick laid in a five-course common bond. Sandstone sills and lintels provide decorative accents, as does an ornate bracketed cornice. </p><p>The house originally consisted of the two-story brick main block with a wood frame ell to the rear, which had a stable for visitors' horses behind it. An 1874 fire destroyed the wing and stables. When the house was later converted into a single-family residence, a small brick wing was added where the frame wing once stood. </p><p>David Hyer, the builder and first owner, was a member of the first group of settlers to arrive in Madison in 1837; he was employed by Augustus A. Bird in the construction of the first Capitol Building. After trying his luck in the 1848 California Gold Rush, Hyer purchased lots ten and eleven of Block 148 from Leonard Farwell, a prominent land speculator. Tax assessments prior to the construction of the hotel valued the lots at three hundred dollars. After construction of the hotel and livery the property was valued at $2,300. Hyer then sold the property in 1855 to proprietor Henry Jaquish for $9,000, an indication of the boom that was then occurring in Third Lake Ridge. </p><p>The second owner, Henry Jaquish, came to Madison by way of Mineral Point during the lead boom. After a short stint in Mineral Point, he farmed for several years in the village of Mazomanie (western Dane County) before purchasing Hyer's Hotel. Jaquish ran the hotel until the fire in 1874, and lived in the brick portion with his family. </p><p>Jacquish's sale came at a time when the hotel business was saturated. The 1875 Madison city directory reveals a total of twenty-six hotels in Madison, seven of them near the railroad depot. After selling the hotel, Jacquish and his wife remained in the Third Lake Ridge, purchasing a house at 1026 Williamson Street. Following the fire, the building functioned as a single-family residence. Joseph E. Kleiner, president of the Madison Candy Company, purchased the house in 1900. As was true of many other executives associated with area industries, Kleiner lived within walking distance of his company, but also lived along side working-class residents. </p><p>The occupancy of Hyer's Hotel during those first twenty years provides an interesting window into Third Lake Ridge. It appears the hotel provided transient lodging for those seeking work in the growing Third Lake Ridge corridor. The 1858 Madison city directory lists the following residents: two carpenters, two painters, a blacksmith, a laborer, a cabinet-maker, a bookkeeper, a tailor, a feed store employee, and Jaquish. The 1860 manuscript census reveals a similar range of occupations. An even mix of and foreign-born immigrants and East Coast migrs residing in the neighborhood with their families and young children. </p><p>The house continued to operate as a single-family residence during much of the twentieth century. In 1910, Art and Genevieve Schulkamp purchased the house, and lived there through his death in 1972. Schulkamp was a prominent banker, insurance agent, and philanthropist in Madison. </p><p>In 1915, the Schulkamps extensively remodeled the structure by knocking out walls to provide open living spaces that were more in keeping with the progressive styles of the period. The porch was also extended at this time, and other changes were made to the interior with new French doors and modern fixtures. Today the building houses several apartments. Hyer's Hotel became a Madison Landmark in 1975 and was listed in the National Register of Historic Places in 1983.</p>",img/TLR/hyers.png,Jared Lowery
Holver Gabriel House,43.07812,-89.36978,811 Jenifer Street,"<p>Along with other sizable houses in its vicinity, including the John George Ott House standing cattycorner to it, the Holver Gabriel House suggests the affluence of some Third Lake Ridge residents during the first two decades of settlement. Built in 1866, the house was constructed in two sections: a main two-story block, and a slightly shorter two-story side ell. Both sections are built of the then fashionable Milwaukee cream city brick.</p><p>The form of the house represents an update of a popular house form in Third Lake Ridge: the side passage double-pile house (also known as the two-thirds Georgian form). The form was popular in the neighborhood during the first few decades, especially in Greek Revival, examples, including the Fauerbach House  and another example across the Street from the Holver Gabriel House at 820 Jenifer Street. In the Holver Gabriel House, the form has been upgraded in several significant ways. </p><p>The more faddish Italianate style, replete with its flat roof and roof brackets, has replaced the previously modish Greek Revival. In addition, the house has been updated with interior trim in keeping with the style. The casings at the Holver Grabriel House match those found in the neighborhood's other affluent houses from this period. </p><p>This house likely had a basement kitchen. Part of this may have been the siting of the house on a hill sloping towards the lake, but the location of the kitchen also suggests a desire to segregate service functions that became increasingly pronounced in the period. Also notable is the early, if not original, side ell, also built to segregate rooms by function.</p><p>Holver Gabriel, a Norwegian immigrant boot and shoemaker, had this house built in 1866. Born in Norway, Gabriel changed his name from Gabrielson"" between 1860 and 1870 to make it soundless Norwegian. The morphology of Gabriel's name compares favorably with his architectural tastes; he chose a conventional Italianate Villa (likely generated from popular pattern books) versus a more traditional form. </p><p>Unfortunately, it is not known who built the house and little is known about Gabriel and his business beyond the movement of his activities around Madison three times between 1866 and 1875. </p><p>By 1883, Gabriel had sold the house to Hiram Moulton, a builder and contractor from Vermont. Moulton came to Wisconsin in 1854 and initially lived on a farm of 143 acres in the Township of Burke, located about eight miles outside of Madison. Moulton had built several buildings in Madison prior to moving there, including a prominent hotel, so his move to Third Lake Ridge likely related to his business. Like Gabriel, Moulton intended that the house convey his wealth and prominence in the community.</p><p>Prominent residents continued to live at 811 Jenifer Street but their occupations reflect changes in Third Lake Ridge due to industrialization. The next two residents both worked at agricultural machinery shops on the growing ""Implement Row"" </p><p>Instead of segregating themselves in suburban enclaves, these wealthy residents distinguished themselves from their working class neighbors in other ways. The Holver Gabriel House partly stood out because of its imposing size and prominent Victorian ornament, but later changes to the house also served to signify the wealth of its occupants. </p><p>Most significant was the large rear porch added during the closing years of the nineteenth century. This provided a prominent lake view, something increasingly valued by this time. The shoreline of Lake Monona was filled in around the turn of the century, and new houses were erected so as to take advantage of the lakeside views. </p><p>Other houses, including the Harlow S. and Isabelle C. Ott House located next door, had two front facades from the start (a street and lake front). The addition of the porch to the rear of this house likely functioned in a similar context. </p>",img/TLR/holver.png,Jared Lowery and Sydney Dobkin
Madison Candy Company,43.07738,-89.37339,740-44 Williamson Street,"<p>The Madison Candy Company was incorporated on 15 February 1899. This building, which emerged in 1903, was the company's second (the first was located at 625 Williamson Street). Local architect and engineer John Nader designed the new three-story brick building. lt was built in a vernacular commercial style typical of many late nineteenth- and early twentieth-century industrial and commercial structures along Williamson Street and within the east side industrial corridor. </p><p>The rectangular building measures forty-five feet wide and sixty feet long; the only addition is a small loading dock on the rear elevation installed in 1980. The load bearing walls measure over a foot thick. Red brick is used on the facade, while cream city bricks make up the side and rear walls.</p><p> The building is capped by a shed roof, which is partially concealed by a front parapet. Ornament is limited to the main facade; the parapet has rusticated concrete caps punctuated by two windows and a central datestone. Windows have curved segmental arched lintels. Concrete is used to distinguish the beltcourses.</p><p> Besides the rear dock and replacement windows, the only major alteration to the exterior of the building occurred when Williamson Street was widened in 1950; at that time, a large exterior staircase was moved inside the lobby area. The interior has been heavily remodeled. </p><p>The multiple chimney stacks on the building suggest that confectionary operations likely occurred on all floors. Some large beams evident on the first floor suggest the loads of equipment and products that the building once contained. The large and extensive windows on the front and back also suggest that natural lighting was used to illuminate the interior workspace. </p><p>The Madison Candy Company was a prominent confectionary business on the city's industrial east side during the early twentieth century. In 1903, Joseph E Kleiner, president of the company, and his partners, Frank Mosel and T.F. and James Prendergast, lived in the Third Lake Ridge neighborhood, as did many of the company's employees. Kleiner originally lived at 854 Jenifer Street (formerly Hyer's Hotel, see entry), the Prendergast family resided at 731 Jenifer Street, and Frank Mosel lived at 939 Jenifer Street. </p><p>Business must have been steady since all of these individuals built prominent architect-designed houses in Third Lake Ridge before 1910.</p><p>After the Madison Candy Company closed, the building went through a number of commercial uses. The Richard Ela Welding Company occupied the building for several decades during the middle of the twentieth century; and an agricultural implement shop was also housed there for a period.</p><p> A Madison City Landmark, the Candy Company building currently houses a restaurant (El Dorado Grill), a coffeehouse (Ground Zero), and office space. Historic photographs of the building are hung on the interior walls.</p>",img/TLR/candyco.png,Jared Lowery
Machinery Row,43.076179,-89.37538,601-627 Williamson Street," <p>Designed by Conover and Porter, ""Machinery Row"" is a series of Romanesque-revival style buildings sporadically constructed for agricultural implement houses between 1898 and 1914. The Williamson Street structures were constructed as follows: 601-607 (1898); 621-623 (1899); 613-615 (1901); 625-627 (1902); and 609-611 (sometime after 1902). By 1899, companies such as the Advance Thresher Company, Case J.I. Threshing Company, Champion Harvesting Machinery, Milwaukee Harvester Company, Osborn D.M. and Company, and Syracuse Chilled Plow Company were all located in Machinery Row.</p><p> The headquarters of these companies were in other midwestern cities where the agricultural implements were manufactured, but field offices such as those in Madison helped the businesses reach broader markets. The Machinery Row offices combined showroom space, service centers, and financial offices. </p><p>Machinery Row is actually a series of brick buildings designed behind a unified facade. It is built largely of Milwaukee ""cream city"" bricks with stone and tile trim on a sturdy sandstone foundation. Distinguishing features include the tower at the northwestern corner and the crenellated cornice on the street facade. Modern changes mainly involve door and window openings and replacement doors and sash. </p><p>Another major change occurred when rail sidings were removed from behind the building where the modern parking lot is located.</p><p>Machinery Row was part of Madison's industrial sector,  collectively known as ""Implement Row."" This label referred to a set of dealers who occupied several blocks on Williamson Street and adjacent Blount Street, where they clustered near the railroad. Before the current structure was erected, the property housed a series of wood-framed structures that catered to the tobacco and ice harvesting industries. </p><p>As more railroads came to Madison and existing spurs were improved, agricultural implement companies seized on the opportunity to sell their products. In 1898 a wealthy banker who acknowledged the demand bought the Daggett-Hill Property and started to replace the wooden structures in piecemeal fashion with existing buildings. By 1902 the property was listed as Madison's second highest taxpayer.</p><p>Almost as soon as Madison experienced a sharp rise in agricultural implement houses, consolidation occurred in the industry. In 1902 J.P. Morgan brokered a merger between McCormick and five other implement companies to form the International Harvester Company (IHC). This move gave IHC a massive amount of capital, along with manufacturing facilities and intellectual property that the smaller implement companies could not compete against. </p><p>The decline in agricultural implement companies that subsequently occurred is reflected in the 1907 Madison City Directory, which lists seventeen implement branches. Likewise, Machinery Row reflects the same pattern. In 1904 seven implement companies were listed at the address, but by 1907 there were only three. </p><p>As industrial properties moved out of Machinery Row, commercial uses took over, which is how the building functions today. It is a contributing element to  the Third Lake Ridge Landmark District and also serves  as a local Madison Landmark.</p>",img/TLR/machineryrow.png,Jared Lowery
Klose Cottage,43.07792,-89.37123,748 Jenifer Street,"<p>The residence known locally as the Klose Cottage"" is an upright and wing house built in 1863. A woodframe house, it is clad with clapboard and vertical board siding. Many of the original four over four windows remain, as do the original doors and interior trim. The property has changed relatively little during the past one hundred and fifty years; only a bump-out bathroom was added off the rear when the house was converted into a two-unit building in 1959. The fact that it has experienced so little change makes the Klose Cottage perhaps the best surviving example of a once ubiquitous house form in the Third Lake Ridge neighborhood.</p><p>According to Tom Hubka, upright and wings (also known as cross-wings, temple front and wings, and other labels) are distinguished by their T-shaped massing. The T-shape allows for the separation of distinct portions of the house by function. The kitchen is usually in the side-gabled wing, as is evident at the Klose Cottage. The more formal public spaces of the house are in the ""upright"" (front gabled) portion of the house, which in this example is entered through a second front door (a common variation). </p><p>Despite its widespread popularity nationally, there is no agreement (even locally) about what to call this popular house type. The popular development of this plan followed early nineteenth-century Western expansion, and it became a dominant Midwestern farmhouse form. The Klose Cottage and countless other examples show it was just as popular in urban settlements throughout the Midwest as well as elsewhere.</p><p>Although the home is associated with a later owner, it was built originally for James Ledwith. He was born in Ireland in 1839 and immigrated to the United States in 1848, likely fleeing the potato famine. He lived in Troy, New York, until 1855 and then moved to Madison. There is no evidence of any other Ledwiths in Wisconsin at this time so it is likely he made the journey west by himself at the age of sixteen. </p><p>The 1858 Madison city directory lists Ledwith, a blacksmith, as boarding at the Wisconsin House (likely Wisconsin Inn on Williamson Street). In 1860 he married Ellen Whalen, also an Irish immigrant, and that year they had their first child. </p><p>Ledwith's house was built during the early years of the boom (1850s and early 1860s) in the Third Lake Ridge neighborhood. Some of this activity was due to the rise of lumber mills as well as new materials brought in by the railroad; the paper continued by noting that ""one stimulus to building this season is the fact that materials are much cheaper, as we are informed, than usual.""</p><p>Although the panic of 1857 quelled building activity somewhat, it did not cease; Ledwith, for example, needed a new house for his family, which now included a new baby. Therefore, Ledwith, a blacksmith and a wagon maker, built the house himself in 1863. Aldolph Klose, a German tailor, was the next resident of 748 Jenifer; he lived there sometime from the 1870s through 1886. </p><p>After this, the house went through a series of residents, most of whom worked at working-class occupations associated with industries in Third Lake Ridge. These include Andrew Hippenmeyer, Jr., a butcher (1886-1902); Hugo Vogel, a collector at MG&E (1907-1946); and several individuals who, during the later twentieth century, worked for the railroad or at nearby Gisholt Manufacturing Company.</p>",img/TLR/klose.png,Julia Griffith and Jared Lowery
L.L. Olds Seed Company,43.07775,-89.37279,722 Williamson Street,"<p>The activities that took place inside the L. L. Olds Seed Company affected many acres of land beyond the Third Lake Ridge neighborhood. Founded in 1888 as a mail order company operating out of Clinton, Wisconsin (between Madison and Chicago), Olds Seed was a large seed packer and distributor with a national market. After expanding beyond its mail order business, the company, in 1914, erected its headquarters at 722 Williamson, where a rail line was available to facilitate the distribution of Old Seeds products. Initially the company specialized in potatoes but gradually expanded, eventually developing a large line of seeds that were used by people who wished to maintain neatly manicured suburban lawns and gardens.</p><p>The Olds Seed Company building is a four-story structure built of steel reinforced concrete clad in brick veneer. It was designed in 1914 by Alvan Small, a locally renowned Prairie-school architect. Minimal prairie-style detailing may be seen at the roofline and around the doorways, although it is largely similar to  the industrial and commercial buildings found throughout Madison's east side corridor. A streamlined neo-classical doorway is found on the eastern end of the facade. </p><p>L.L. Olds, founder of the company that bears his name, was born in Rock County, Wisconsin, and grew up on a potato farm near Clinton. Olds started his mail order catalog company in 1888 by mailing out five hundred copies of a catalog that emphasized his specialty: potatoes. All of the seeds came from a single source: his two hundred acre farm. In 1893 Olds Seed participated in the Columbian World's Exposition (Chicago) and exhibited sixty-five varieties of potatoes, including one new variety. Their catalog not only included potatoes, but also corn, oats, barely, and a few garden seeds. In 1895 Olds doubled the capacity of the warehouse on his farm and eventually built a new three-story facility located along the Chicago & Northwestern Railroad tracks in Clinton. Although a 1908 a fire destroyed this warehouse (and a $24,000 inventory), the company was growing at such a pace that the conflagration did little to slow its growth. </p><p>Olds Seed moved to Madison in 1908, originally to Wilson Street and eventually to the handsome headquarters at 722 Williamson. Although Olds could have chosen either Chicago or Rockford, Illinois, as a location for his business, he was interested in Madison because of its good rail connections and proximity to the University of Wisconsin. His move to Madison demonstrates the degree to which he valued agricultural research. Olds briefly lived in the Third Lake Ridge neighborhood at 840 Spaight Street before moving to Madison's near west side suburb of University Heights. </p><p>Olds Seeds remained in the building until 1972, at which point it relocated elsewhere in Madison. The building has gone through a number of subsequent transformations a part of adaptive reuse efforts, but still retains its basic exterior form.</p>",img/TLR/olds.png,Jared Lowery
