name,latitude,longitude,address,description,imagepath,author
Ely House ,43.071849,-89.416586,205 Prospect Avenue ,"<p>One of the first residences built in University Heights, the Ely House, is an excellent example of nineteenth-century eclecticism preceding the so-called progressive"" designs that would follow in the neighborhood. A two-story wood-frame Georgian Revival design by the architect Charles Sumner Frost, the house is a Victorian adaptation of the historic Longfellow House in Cambridge, Massachusetts.</p><p> Its narrow clapboard siding, symmetrical facade, and classical elements clearly draw inspiration from Colonial American styles.  These colonial elements can be found in the materials used and the simple rectangular massing with small dormers and classical proportions. </p><p>A high-pitched roof with dormer windows tops a classically inspired cornice. The central pediments situated below project slightly and are supported by pilasters, which give the house a classical effect. A one-story ionic portico projects from the front entrance. Elaborate frames and woodworking around the windows and doors place the design in a more Victorian tradition.</p><p>Richard Ely, the original owner and builder of the house, played a large role in the development of University Heights. A member of the original University Heights Company, he also continued in the role of neighborhood booster and developer for many years after moving to the area. </p><p>Ely came to Madison in 1892 to organize the new Departments of Economics, Political Science, and History at the University of Wisconsin. Famous in his own time, Ely soon became the director of the economics department. </p><p>Taking a significantly more progressive view than that of economics establishment, Ely was willing to debate the laissez-faire models that dominated the field during the early twentieth century. Ely was charged with teaching subversive doctrine in 1894, a discussion of corporate abuses and trust policy in the country, and investigated by the University's Board of Regents. Eventually vindicated, Ely quickly became a champion and symbol for academic freedom and the University of Wisconsin. </p><p>Willing to talk about Marxism and Socialism at the turn of the century, Ely made many notable friends in progressive circles such as Bob LaFollette, Sr., and Theodore Roosevelt; and his house became an open meeting place for established reformists. At the time of Ely's death, the New York Times described him as ""the dean of American economics."" Married twice, Ely had many children, some of whom would also settle with their families in University Heights. Since the Ely family departed their house in 1958 it has been occupied Edwin Taylor, a professor at the university, and the Barash family, two clinical doctors who work at the University of Wisconsin Hospital.</p><p>The overall appearance and style of the house is odd in light of Ely's character, associations, and supposed taste. Since he is known to have had a large role in the design and construction of the house, and he chose a Chicago architect with a progressive reputation, the traditional, if not out of fashion, Georgian Revival style seems an odd choice. </p><p>Ely was vocally critical of traditional building designs on the University campus and of choosing architects and styles with little relation to Wisconsin or progressive associations. Yet he picked exactly those same features for his own large home. </p>",img/uHeights/ely.png,Rowan Davidson
Fett House,43.069478,-89.415251,1711 Van Hise Avenue,"<p>The George Fett house is one of the largest bungalow homes in Madison and an excellent example of the style. While there is neither a known architect or designer nor any records of the building's construction, elements of the house reveal the influence of Arts and Crafts and Prairie-style design sensibilities. The one-and-one-half-story house is principally low, horizontal, and massive with large brick piers on the broad, sweeping porch that refers to the Bungalow styles of the Craftsman magazine. Typical of the style and period, the Fett House utilizes fine materials and unostentatious details through stained glass windows in simple geometric patterns, stucco siding, and dark stained wood trim throughout. </p><p>The original owner, George Fett, was the corporate secretary for the Madison-based Menges Pharmacy Company and a pharmacist by profession. His workplace and pharmacy were located just on the other side of the neighborhood at 901 University Avenue.  Fett moved his family to the house at 1711 Van Hise when he assumed the manager's position; they had previously lived elsewhere in the neighborhood at 45 Lathrop Street. The subsequent owner, Gustavs Martinsons, worked as a project architect with Flad and Associates in Madison for much of the post-World War II period.</p><p>The Fetts's pattern of movement is typical for residents of the neighborhood. Many University Heights residents tended to purchase smaller homes on the periphery at first, and then moved into larger, more expensive homes in the district as their families and careers changed to allow it. This was and is especially common among members of the UW-Madison faculty. Even for those not involved with the University, the neighborhood could support changing needs, interests, and aspirations.</p>",img/uHeights/Fett.png,Rowan Davidson
Gilmore House ,43.07079,-89.4185, 120 Ely Place ,"<p>The Eugene Gilmore House, located at the highest point in University Heights and offering panoramic views of the University campus and the State Capitol, was designed by Frank Lloyd Wright. The house is an excellent example of Prairie Style architecture, it is intentionally united with its advantageous site, and displays several hallmark features of the style: strong horizontal lines, extended walls, sweeping eaves, and banded windows. Given its location and form, the residence has been nicknamed the Airplane House.""</p><p>The wings that give the composition its aeronautical name spread out from a T-shaped plan with an obscured entrance below grade on the first floor. Most of the living spaces are on the second floor to take advantage of the views and the privacy gained from being set farther away from the street and neighbors. </p><p>Typical of Wright's work, the decoration is limited to geometric leaded glass patterns set in banded casement windows across private and public interior spaces. A copper batten-seam roof, very expensive at the time, covers both wings that extend outward from the forward-facing central pavilion and its triangular balconies at each end. </p><p>Eugene Gilmore, one of Wright's more famous and influential clients, came to Madison in 1902 with his wife, Blanche, from a successful Boston law firm to join the faculty at the University of Wisconsin's law school. He quickly rose up the administrative ladder and became famous for his many reformist ideas, efficiency, and organizational skills that would later lead to his appointment as the Vice-Governor of the Philippines in 1922. He returned to the United States and academia, becoming dean of the University of Iowa law school, and president of the same university in 1934. </p><p>After Gilmore left Madison he transferred ownership of the house to Kenneth Parsons, another University of Wisconsin professor. </p><p>The Gilmores had purchased the difficult and prominent lot for their future home on the advice of their soon-to-be neighbor, Richard Ely. They chose Wright as their architect after seeing his work in an early 1908 Architectural Record article.</p><p> Wright's designs were increasingly popular at the time, and they also carried the connotations of a uniquely American, if not Midwestern, architecture and progressive ideals. The house had a large budget of $8,000, but went over the amount by an additional $2,000 due to trouble finding a carpenter willing to take on the project because of the unusual framing details. </p><p>Gilmore ended up supervising the construction himself since Wright conducted the design and supervision in absentia. In 1929 the house was significantly altered to make room for a three-car garage in the back and by making adjustments to the difficult entry. The work was executed by the local Madison architecture firm of Law, Law, and Potter and matches the materials and methods of the original design, if not the spirit.</p>",img/uHeights/gilmore.png,Rowan Davidson
Morehouse House ,43.07099,-89.41764, 101 Ely Place ,"<p>Towards the end of the construction in University Heights, a few modern styles were introduced into the neighborhood. In 1936, Edward and Anna Morehouse contracted the architects Keck and Keck to design and build a home in the International Style, explicitly drawing influences from European design trends. Located in view of the Gilmore, Ely, and Buell houses, the Morehouse residence surprised onlookers with its bold appearance. </p><p>Largely unaltered since its construction in 1936, the house emphasizes simple geometric volumes and the application of thin skin-like surfaces over a light structural frame. The two-story house, set into the hillside that slopes down Summit Avenue from Ely Place, is arranged with four bedrooms similar to later walk-out designs, so that each floor, including the basement, has livable spaces with full access to the exterior. </p><p>The exterior walls of the basic white cube, punctured by vertical ribbons of windows with frames painted a dark brown to contrast with the light stucco exterior, create the effect of an intentionally asymmetrical abstract composition.  The windows are grouped closely at the corners for a visual effect that results in a re-entrant corner detail, which foreshadows a common Modernist design element that would be seen later in the apartments and office towers of Mies Van Der Rohe. </p><p>Despite these innovations, the house still utilized such common building practices as wood stud balloon frame construction, fine finishes, and walls of stucco on the exterior and plaster on the interior over metal lath. The overall design was also comprehensive, given the casework, original furniture, and light fixtures were all designed by Keck and Keck.</p><p>Edward Morehouse's reputation was as a progressive, if not radical, thinker at the time. Serving as both a Wisconsin Public Service Commission economist and Professor of Economics at the University, Morehouse came to live with his family in University Heights by way of familial connections. His wife, Anna, was the daughter of the prominent and influential economist Richard Ely from Ely's first marriage. </p><p>Ely lived only a few houses away and was instrumental in bringing the Morehouses to live in Madison and work for the state. Likewise, Anna attended the University of Wisconsin along with her good friend Catherine, who would later become George Keck's wife. </p><p>Subsequent occupants of the house, the Alberty and Olsen families, have also been employed as faculty at the University of Wisconsin.Born in Watertown, Wisconsin, George Keck worked as an engineer and tried his hand at abstract painting before settling on the profession of architecture in Chicago during the 1920s. His brother, William, joined him shortly and their firm became known for producing high-quality modern designs explicitly influenced by the Bauhaus School. </p><p>Their work was typically not as severe and mechanistic as many European examples and reveals distinctly American sensibilities in the Morehouse house, including organic and Wrightian influences and the attention given to siting considerations. This latter feature became even more apparent as the limited passive solar design elements found in the Morehouse house were stressed in later Keck and Keck work. </p>",img/uHeights/morehouse.png,Rowan Davidson
Morris House ,43.07035,-89.4174, 1815 Summit Avenue ,"<p>The Morris House stands near the highest point in University Heights, where Ely Place intersects with Summit Avenue. Like a number of other houses in the area, the Morris House can broadly be considered a Prairie style design. The architect, Alvan Small, had a reputation for this kind of design and, along with architects Claude and Starck, can be considered a pioneer in Madison's version of the style. </p><p>The house displays primarily a stucco exterior with brick elements at either end of the long building, both at the entrance and porch and garage. Occasional groupings of leaded glass windows and wood banding emphasize the house's length and horizontal design. Consistent proportions, siting, and the use of similar design elements in simple ways to produce individualized work for clients typify Small's work. </p><p>Other similar houses designed by Small in University Heights include the Allen House at 2014 Chamberlain Avenue, the Haen House at 2017 Kendall Avenue, the Johnson House at 1713 Chadbourne Avenue, and the Jones House at 1717 Summit Avenue. </p><p>Small's Prairie style homes were variations on a theme: they almost always displayed a simple two-story rectangular box with side gables and stucco walls. These houses would typically have overhanging eaves, grouped windows, simple wood trim, and Craftsman interior details. Comparing the Morris House to the Whitson House, designed by Claude and Starck, reveals similarities within Madison's architectural community at the time.</p><p>Thomas Morris, the original owner, was a successful and prominent Madison businessman with close connections to the University of Wisconsin. It was perhaps these connections, a large faculty population and proximity to campus, that drew him and his family to University Heights.</p><p> The popularity of the Craftsman magazine also helped to disseminate many of the design philosophies and aesthetic tastes that became commonplace in University Heights, and it is likely that some of the work of designers like Small was brought to the attention of the Morris family in this way. Later inhabitants of the Morris House have included Cyrus MacDuffee, a university professor, and his family.</p><p>Born and educated in Madison, Small had experience in Sullivan's office as well as in collaborations with Connover and Porter and other Madison-based architects. Small had his own firm after 1907, and later in life he partnered with another influential Madison architect, John Flad. </p><p>The development of Madison's version of the prairie style was a group project, in which Small played a key part.</p>",img/uHeights/morris.png,Rowan Davidson
Randall School ,43.067871,-89.417025, 1802 Regent Street ,"<p>Randall School, located on busy Regent Street at the southern edge of University Heights, was built shortly after the City of Madison annexed the area, and brought utilities and services, such as the school, to the new neighborhood. The original section, which can still be seen in the central three bays of the Spooner Street facade, was designed by Madison architect Alvan E. Small, then working in the office of Conover and Porter Architects.</p><p> The school was built to handle the growing school-age population of children who belonged to the educated and affluent families of the quickly growing neighborhood. The school displays a modified Tudor revival style with traces of the increasingly popular Prairie style, which are visible in its non-historicist ornament as well as the bands of windows clearly arranged into the distinctive classroom bays on each floor of the structure. </p><p>The school dates from a period in Madison history that saw rapid expansion of the city to the west and east and the expansion of its municipal government, including the Madison School District. Half of the block along Regent Street that had not yet been purchased was set aside for the school in the initial plat of University Heights.</p><p> Following the school's completion the adjacent playing fields on the same block were donated in 1907 by Burr Jones, a prominent Madison attorney and original partner in the University Heights Company. They were named Olive Jones Field in memory of his recently deceased daughter. Later additions to the school faithfully followed the spirit and architectural language of the original design. </p><p>The first addition occurred at the north end in 1912, followed by the south end in 1925. Randall is also the oldest continuously operating school in Madison.</p>",img/uHeights/randall.png,Rowan Davidson
Sellery House ,43.069532,-89.420079, 2021 Van Hise Avenue ,"<p>The Sellery House is an unusual and derivative design that blends elements from the Egyptian Revival and Prairie styles. The overall composition is almost identical to a 1907 house designed by George Maher, a successful Prairie Style architect, for Henry Schultz in Winnetka, Illinois. </p><p>While Maher had a working relationship with a number of Madison-based architects, none of them was responsible for the work done on behalf of the Sellery family. Instead, the house may have been designed by the Chicago firm of Murphy and Cloyes. The design lacks some of the detail in scale and proportion that is exhibited in many of the other Prairie Style homes in the area.</p><p>Although little is known about the architect, a great deal is known about the original owner and occupant. George Sellery commissioned the house in 1910, the same year he was named Dean of the College of Letters and Science at the University of Wisconsin. He had previously spent ten years as a professor of European history at the University, having arrived in Madison directly from his graduate studies. </p><p>The family moved to University Heights because of Sellery's new position and the young family's need for a larger home. Sellery served as Dean of the College of Letters and Science until 1942, when he retired after decades of influential service and teaching. </p><p>He also served briefly as the acting President of the University in 1937 and had a profound impact on the University as an institution. A number of streets, buildings, and organizations around the University and Madison still carry his name. He lived at the same address until his death in 1962; the house was sold following the death of his wife, Beatrice, four years later.</p>",img/uHeights/sellery.png,Rowan Davidson
Terrace Homes Apartments ,43.070026,-89.413925,114-118 North Breese Terrace ,"<p>Terrace Homes apartments at the corner of Breese Terrace and Hoyt Avenue, designed by architect Philip Homer for the contractors and realtors Paul E. Stark and John Findorff and Sons, was built in 1927 as a cooperative apartment. Although similar to the condominium models popular in America's larger cities during the 1920s, it is likely the only apartment building of its type in Madison of the era.</p><p> However, it took some time for this ownership model to be adopted since the impact of the Great Depression, which occurred shortly after the building's completion, kept a large number of its units empty until the post-World War II years. The high value of the property and its ownership requirements meant that the Terrace Construction Company held five units, in lieu of payment for work completed, until 1938. </p><p> By 1945 a majority of the shares in the cooperative were owned by residents and ownership was transferred to the organization, which still exists today. The success of cooperative living models elsewhere brought the idea to the attention of developers Stark and Findorff, who were eager to introduce the often luxurious and urban approach to a rapidly growing Madison. </p><p>The architect, Homer, had recently visited the newly completed large-scale condominiums at Jackson Park on the south side of Chicago and witnessed the extensive demand for such units. The site along Breese Terrace, snuggled between the wealthy homes of University Heights and the hustle and bustle of the campus and Camp Randall along a street car line, likely seemed a good location. </p><p>The building, with the exception of some adjustments and additions to accommodate fire codes and modern utilities, closely resembles its original form. Its design clearly embraces the eclectic neo-Tudor and modified English style popular in the 1920s as evidenced by its allusions to the taste and stability of manor houses in England. The exterior of the masonry structure is clad in brick with tile accents and rough stone headers, lintels, and frames; the building carries the Tudor design through the exterior with the exception of the rear recesses, which, for economic reasons, were left in unadorned brick. </p><p>The exterior also has notable decorative parapets, stone banding, asbestos-shingled projections over exterior doors, and varied and highly elaborate chimneys that slim as they rise vertically up the length of the building. Each chimney is shaped as a polygon with variegated brick designs. The leaded glass windows, which still exist today, are visible on all of the exterior street-facing facades, while the rear windows for kitchens, bathrooms, and service elements have simple double-hung glazing. </p><p>Because of the socio-economic status of the residents and the expense of the cooperative units, the apartments also used the recently developed Stephens System of soundproofing. This system, which had the floor joists resting on cushioned steel saddles, allowed the space between the concrete and wood floors to be filled with sound-dampening insulation.</p><p>Local Madison architect Philip Homer designed the building for Stark and Findorff; Homer then proceeded to live there with his wife, Gladys, until his death decades later. Born in LaCrosse and from 1912 on a lifelong Madisonian, Homer worked during the 1920s as the chief architect for the Stark Land Company and Capital Construction Company, both owned by Paul Stark. Homer was also responsible for the design of Schenk's Department Store on Atwood Avenue and the Mifflin Arcade on Mifflin Street. </p><p>While usually successful, Homer was forced to work as an automobile salesman during the lean years of the 1930s before returning to private architectural practice after World War II. Like a number of the original occupants, the middle-class Homers, with their small family, remained in the building for a long time.  It has always had thirteen units, twelve for owners/tenants and one for the building superintendent. </p><p>The professions and occupations of the residents have varied greatly, ranging from professionals such as engineers, architects, and dentists, to others in the trades and services, including salespeople, firefighters, and a university facilities janitor. Generally, the units have provided residents with a stable, comfortable, and private living environment; these same provisions and preferences are similar to the majority of University Heights residents, although they are not necessarily in keeping with tenant conditions along Breese Terrace. </p>",img/uHeights/terrace.png,Rowan Davidson
Whitson House ,43.07191,-89.41952,1920 Arlington Place ,"<p>In 1905, Andrew Whitson, a Professor of Soils at the University of Wisconsin, contracted the Madison architectural firm of Claude and Starck to design and build his house. The University Heights neighborhood, well established by this time, was a focal point for progressive residential architectural styles in the period, and Claude and Starck were active in this development. </p><p>Although Wilson's house clearly shows aspects of Gothic and Tudor revival influences, a number of more modern stylistic features are also apparent. The house has stucco siding with painted wood trim banding and a wood belt course that separates the two stories. Many of the windows are grouped together in asymmetrical elevations. The windows in the stairwell off the main entrance are polygons, a feature that would be repeated many times in other Claude and Starck designs.</p><p>Along with the vaguely Arts and Crafts approach, the house has a degree of simplicity, attention to its site, and horizontality that foreshadow the Prairie School then becoming popular. Indeed, Claude and Starck were among Madison's most prolific Prairie School practitioners. </p><p>The faculty and professionals living in University Heights saw themselves as making a statement about their position and concerns by hiring architects such as Claude and Starck to design their stylish homes. Since that time the neighborhood's occupants have not changed greatly; Peter Morrison, a university professor, lived in the house after the Whitsons. </p><p>The Whitson house represents the first in a long string of very similar designs by Claude and Starck in Madison. A number are in University Heights, some quite close to the Whitson House, including the Steven House at 1908 Arlington Place, the Meyer House at 1937 Arlington Place, and the Pence House at the end of the same block. All of these homes were commissioned and built over a ten-year span from 1904 to 1914. </p><p>During the preceding decade both Louis Claude and Edward Starck spent some time working and learning their profession in Chicago, where they collaborated with the offices of George Maher and Louis Sullivan. Certainly some direct influence of Maher's architecture can be detected in their Madison designs; however, the development of their particular version of the Prairie Style appears to be one of cross-currents since they developed a unique approach of mixing Gothic touches with typical Prairie design elements and motifs that others across the region would follow. </p>",img/uHeights/whiston.png,Rowan Davidson
